[
  { "id": "1001", "text": "Day 3 at BigCorp on the design system team. So many meetings just to change a button radius. There has to be a better way to ship.", "created_at": "2024-02-12T17:04:00.000Z", "is_retweet": false, "is_reply": false, "lang": "en" },
  { "id": "1002", "text": "Spent the weekend rebuilding our component library in Storybook. 400 components, 0 docs. Pray for me.", "created_at": "2024-03-30T21:18:00.000Z", "is_retweet": false, "is_reply": false, "lang": "en" },
  { "id": "1003", "text": "@devpeer_demo honestly the framework wars are a distraction. ship something. anything.", "created_at": "2024-05-02T14:11:00.000Z", "is_retweet": false, "is_reply": true, "lang": "en" },
  { "id": "1004", "text": "Hot take: most 'scalability' problems are imaginary. You will not have a million users. Build for the ten you have.", "created_at": "2024-07-19T16:45:00.000Z", "is_retweet": false, "is_reply": false, "lang": "en" },
  { "id": "1005", "text": "Quit BigCorp today. Three years of process. I want to feel the whole loop again — idea to user — without a Jira ticket in between.", "created_at": "2024-09-06T23:02:00.000Z", "is_retweet": false, "is_reply": false, "lang": "en" },
  { "id": "1006", "text": "First indie app shipped in a weekend. A tiny offline notes thing. 12 users. I have never been happier.", "created_at": "2024-10-14T19:30:00.000Z", "is_retweet": false, "is_reply": false, "lang": "en" },
  { "id": "1007", "text": "The cloud was a mistake for small apps. Your data should live on your device. Sync is a feature, not a foundation.", "created_at": "2024-12-01T15:22:00.000Z", "is_retweet": false, "is_reply": false, "lang": "en" },
  { "id": "1008", "text": "local-first isn't nostalgia. it's the only way to build software that respects the person using it. own your data, own your tools.", "created_at": "2025-01-20T18:09:00.000Z", "is_retweet": false, "is_reply": false, "lang": "en" },
  { "id": "1009", "text": "@devpeer_demo the moat was never the tech. it's having a point of view. generic tools are already free.", "created_at": "2025-03-11T13:55:00.000Z", "is_retweet": false, "is_reply": true, "lang": "en" },
  { "id": "1010", "text": "Shipping in public changed everything for me. Every bug fix is a tweet. Every user is a conversation. The build IS the marketing.", "created_at": "2025-05-08T20:41:00.000Z", "is_retweet": false, "is_reply": false, "lang": "en" },
  { "id": "1011", "text": "Crossed $2k MRR on the notes app today. From 12 users to 800 paying in 8 months. Small and sharp beats big and generic, every time.", "created_at": "2025-07-22T17:33:00.000Z", "is_retweet": false, "is_reply": false, "lang": "en" },
  { "id": "1012", "text": "I keep meeting devs waiting to feel 'ready' to go indie. You don't get ready first. You start, and the readiness shows up later.", "created_at": "2025-10-03T16:12:00.000Z", "is_retweet": false, "is_reply": false, "lang": "en" },
  { "id": "1013", "text": "Honestly torn: I preach 'build for the ten users you have' but I refresh my MRR chart ten times a day. Growth brain is hard to quit.", "created_at": "2026-01-15T22:48:00.000Z", "is_retweet": false, "is_reply": false, "lang": "en" },
  { "id": "1014", "text": "Two years out of BigCorp. The lesson that stuck: software is just a way to hand someone your point of view. Make it personal or don't bother.", "created_at": "2026-04-27T18:00:00.000Z", "is_retweet": false, "is_reply": false, "lang": "en" }
]
